{
  "title": "[AI] 자료구조 12주차 소스코드.txt",
  "mode": 3,
  "language": "text",
  "question": "[챌린지 1] class Node():\n[챌린지 2] def printNodes(start):\n[챌린지 3] def get_list_data():\n[챌린지 4] def appendNode(newData):\n[챌린지 5] def insertNode(findData, insertData):\n[챌린지 6] def insertAt(index, data):\n[챌린지 7] def deleteNode(deleteData):\n[챌린지 8] def clearList():\n[챌린지 9] def searchNode(target):\n[챌린지 10] def saveToFile(filename):\n[챌린지 11] def loadFromFile(filename):\n[챌린지 12] # 전역 변수 선언\n[챌린지 13] if __name__ == \"__main__\":",
  "question_text": "[챌린지 1] class Node():\n[챌린지 2] def printNodes(start):\n[챌린지 3] def get_list_data():\n[챌린지 4] def appendNode(newData):\n[챌린지 5] def insertNode(findData, insertData):\n[챌린지 6] def insertAt(index, data):\n[챌린지 7] def deleteNode(deleteData):\n[챌린지 8] def clearList():\n[챌린지 9] def searchNode(target):\n[챌린지 10] def saveToFile(filename):\n[챌린지 11] def loadFromFile(filename):\n[챌린지 12] # 전역 변수 선언\n[챌린지 13] if __name__ == \"__main__\":",
  "answer": "## 클래스와 함수 선언 부분 ##\nclass Node():\n    def __init__(self):\n        self.data = None\n        self.link = None\n\ndef printNodes(start):\n    \"\"\"현재 연결 리스트 전체를 출력\"\"\"\n    current = start\n    if current is None:\n        print(\"(빈 리스트)\")\n        return\n    print(\"현재 리스트:\", end=' ')\n    print(current.data, end=' ')\n    while current.link is not None:\n        current = current.link\n        print(current.data, end=' ')\n    print()\n\ndef get_list_data():\n    \"\"\"연결 리스트의 data들을 파이썬 리스트로 반환 (파일 저장용)\"\"\"\n    result = []\n    current = head\n    while current is not None:\n        result.append(current.data)\n        current = current.link\n    return result\n\ndef appendNode(newData):\n    \"\"\"맨 뒤에 노드 추가\"\"\"\n    global head\n    node = Node()\n    node.data = newData\n    if head is None:\n        head = node\n        return\n    current = head\n    while current.link is not None:\n        current = current.link\n    current.link = node\n\ndef insertNode(findData, insertData):\n    \"\"\"특정 데이터 앞에 삽입, 못 찾으면 맨 뒤에 추가\"\"\"\n    global head\n    \n    # 리스트가 비어 있을 경우\n    if head is None:\n        node = Node()\n        node.data = insertData\n        head = node\n        return\n\n    # 첫 번째 노드가 findData인 경우 (맨 앞 삽입)\n    if head.data == findData:\n        node = Node()\n        node.data = insertData\n        node.link = head\n        head = node\n        return\n\n    # 그 외 노드 탐색\n    current = head\n    while current.link is not None:\n        pre = current\n        current = current.link\n        if current.data == findData:\n            node = Node()\n            node.data = insertData\n            node.link = current\n            pre.link = node\n            return\n\n    # findData를 끝까지 못 찾으면 맨 뒤에 추가\n    node = Node()\n    node.data = insertData\n    current.link = node\n\ndef insertAt(index, data):\n    \"\"\"특정 인덱스 위치에 노드 삽입\"\"\"\n    global head\n    \n    if index < 0:\n        print(\"인덱스는 0 이상이어야 합니다.\")\n        return\n\n    newNode = Node()\n    newNode.data = data\n\n    # 인덱스가 0 (맨 앞 삽입)\n    if index == 0:\n        newNode.link = head\n        head = newNode\n        return\n\n    # 중간 또는 끝 삽입을 위해 순회\n    current = head\n    currentIndex = 0\n    \n    # 삽입 위치 바로 직전(index-1)까지 이동\n    while current is not None and currentIndex < index - 1:\n        current = current.link\n        currentIndex += 1\n    \n    if current is None:\n        print(\"인덱스가 리스트의 길이를 초과했습니다.\")\n        return\n\n    # 삽입 실행\n    newNode.link = current.link\n    current.link = newNode\n\ndef deleteNode(deleteData):\n    \"\"\"특정 데이터 삭제\"\"\"\n    global head, current, pre\n\n    if head is None:\n        print(\"삭제할 노드가 없습니다.(빈 리스트)\")\n        return\n\n    # 첫 번째 노드가 삭제 대상인 경우\n    if head.data == deleteData:\n        current = head\n        head = head.link\n        del(current)\n        return\n\n    # 그 외 노드 탐색\n    current = head\n    while current.link is not None:\n        pre = current\n        current = current.link\n        if current.data == deleteData:\n            pre.link = current.link\n            del(current)\n            return\n\n    print(f\"'{deleteData}' 데이터를 찾을 수 없습니다.\")\n\ndef clearList():\n    \"\"\"리스트 전체 초기화\"\"\"\n    global head\n    head = None\n    print(\"리스트가 초기화되었습니다.\")\n\ndef searchNode(target):\n    \"\"\"target을 검색해서 인덱스 리스트 반환\"\"\"\n    global head\n    indexes = []\n    current = head\n    idx = 0\n    while current is not None:\n        if current.data == target:\n            indexes.append(idx)\n        current = current.link\n        idx += 1\n    return indexes\n\ndef saveToFile(filename):\n    \"\"\"현재 리스트 데이터를 파일에 저장\"\"\"\n    data_list = get_list_data()\n    with open(filename, 'w', encoding='utf-8') as f:\n        for item in data_list:\n            f.write(str(item) + '\\n')\n    print(f\"리스트가 파일로 저장되었습니다. ({filename})\")\n\ndef loadFromFile(filename):\n    \"\"\"파일에서 데이터를 읽어 리스트 재구성\"\"\"\n    global head\n    try:\n        with open(filename, 'r', encoding='utf-8') as f:\n            lines = f.readlines()\n    except FileNotFoundError:\n        print(\"파일을 찾을 수 없습니다.\")\n        return\n\n    # 기존 리스트 초기화 후 다시 구성\n    head = None\n    for line in lines:\n        data = line.strip()\n        if data != '':\n            appendNode(data)\n    print(f\"파일에서 리스트를 불러왔습니다. ({filename})\")\n\n## 전역 변수 선언 부분 ##\nmemory = []\nhead, current, pre = None, None, None\n\n## 메인 코드 부분 ##\nif __name__ == \"__main__\":\n    # 초기 데이터 셋팅\n    dataArray = [\"서울대\", \"고대\", \"연대\", \"두원\", \"부산\"]\n    for data in dataArray:\n        appendNode(data)\n    \n    print(\"초기 연결 리스트:\")\n    printNodes(head)\n\n    # 사용자 입력 기반 메뉴\n    select = -1\n    while select != 9:\n        print(\"\\n--- 연결 리스트 메뉴 ---\")\n        print(\"1: 추가 (맨 뒤)\")\n        print(\"2: 삽입 (특정 데이터 앞에 삽입)\")\n        print(\"3: 삽입 (특정 위치에 삽입)\")\n        print(\"4: 삭제 (특정 데이터 삭제 / 삭제 전 확인)\")\n        print(\"5: 리스트 초기화\")\n        print(\"6: 검색 (데이터 -> 인덱스)\")\n        print(\"7: 파일 저장\")\n        print(\"8: 파일 불러오기\")\n        print(\"9: 종료\")\n\n        try:\n            select = int(input(\"메뉴 선택: \"))\n        except ValueError:\n            print(\"숫자를 입력하세요.\")\n            continue\n\n        if select == 1:\n            data = input(\"추가할 데이터 입력: \")\n            appendNode(data)\n            printNodes(head)\n        \n        elif select == 2:\n            findData = input(\"어느 데이터 앞에 삽입할까요? (찾을 데이터): \")\n            insertData = input(\"삽입할 데이터 입력: \")\n            insertNode(findData, insertData)\n            printNodes(head)\n        \n        elif select == 3:\n            try:\n                idx = int(input(\"삽입할 인덱스 번호 입력: \"))\n                data = input(\"삽입할 데이터 입력: \")\n                insertAt(idx, data)\n                printNodes(head)\n            except ValueError:\n                print(\"인덱스는 숫자로 입력해야 합니다.\")\n\n        elif select == 4:\n            delData = input(\"삭제할 데이터 입력: \")\n            confirm = input(f\"정말로 '{delData}'를 삭제할까요? (y/n): \")\n            if confirm.lower() == 'y':\n                deleteNode(delData)\n                printNodes(head)\n            else:\n                print(\"삭제를 취소했습니다.\")\n                printNodes(head)\n\n        elif select == 5:\n            clearList()\n            printNodes(head)\n\n        elif select == 6:\n            data = input(\"검색할 데이터 입력: \")\n            indexes = searchNode(data)\n            if indexes:\n                print(f\"'{data}' 데이터는 다음 인덱스에 있습니다: {indexes}\")\n            else:\n                print(f\"'{data}' 데이터는 리스트에 없습니다.\")\n\n        elif select == 7:\n            filename = input(\"저장할 파일 이름 입력 (예: data.txt): \")\n            saveToFile(filename)\n\n        elif select == 8:\n            filename = input(\"불러올 파일 이름 입력 (예: data.txt): \")\n            loadFromFile(filename)\n            printNodes(head)\n\n        elif select == 9:\n            print(\"프로그램을 종료합니다.\")\n        \n        else:\n            print(\"잘못된 선택입니다. 다시 입력하세요.\")",
  "answer_text": "## 클래스와 함수 선언 부분 ##\nclass Node():\n    def __init__(self):\n        self.data = None\n        self.link = None\n\ndef printNodes(start):\n    \"\"\"현재 연결 리스트 전체를 출력\"\"\"\n    current = start\n    if current is None:\n        print(\"(빈 리스트)\")\n        return\n    print(\"현재 리스트:\", end=' ')\n    print(current.data, end=' ')\n    while current.link is not None:\n        current = current.link\n        print(current.data, end=' ')\n    print()\n\ndef get_list_data():\n    \"\"\"연결 리스트의 data들을 파이썬 리스트로 반환 (파일 저장용)\"\"\"\n    result = []\n    current = head\n    while current is not None:\n        result.append(current.data)\n        current = current.link\n    return result\n\ndef appendNode(newData):\n    \"\"\"맨 뒤에 노드 추가\"\"\"\n    global head\n    node = Node()\n    node.data = newData\n    if head is None:\n        head = node\n        return\n    current = head\n    while current.link is not None:\n        current = current.link\n    current.link = node\n\ndef insertNode(findData, insertData):\n    \"\"\"특정 데이터 앞에 삽입, 못 찾으면 맨 뒤에 추가\"\"\"\n    global head\n    \n    # 리스트가 비어 있을 경우\n    if head is None:\n        node = Node()\n        node.data = insertData\n        head = node\n        return\n\n    # 첫 번째 노드가 findData인 경우 (맨 앞 삽입)\n    if head.data == findData:\n        node = Node()\n        node.data = insertData\n        node.link = head\n        head = node\n        return\n\n    # 그 외 노드 탐색\n    current = head\n    while current.link is not None:\n        pre = current\n        current = current.link\n        if current.data == findData:\n            node = Node()\n            node.data = insertData\n            node.link = current\n            pre.link = node\n            return\n\n    # findData를 끝까지 못 찾으면 맨 뒤에 추가\n    node = Node()\n    node.data = insertData\n    current.link = node\n\ndef insertAt(index, data):\n    \"\"\"특정 인덱스 위치에 노드 삽입\"\"\"\n    global head\n    \n    if index < 0:\n        print(\"인덱스는 0 이상이어야 합니다.\")\n        return\n\n    newNode = Node()\n    newNode.data = data\n\n    # 인덱스가 0 (맨 앞 삽입)\n    if index == 0:\n        newNode.link = head\n        head = newNode\n        return\n\n    # 중간 또는 끝 삽입을 위해 순회\n    current = head\n    currentIndex = 0\n    \n    # 삽입 위치 바로 직전(index-1)까지 이동\n    while current is not None and currentIndex < index - 1:\n        current = current.link\n        currentIndex += 1\n    \n    if current is None:\n        print(\"인덱스가 리스트의 길이를 초과했습니다.\")\n        return\n\n    # 삽입 실행\n    newNode.link = current.link\n    current.link = newNode\n\ndef deleteNode(deleteData):\n    \"\"\"특정 데이터 삭제\"\"\"\n    global head, current, pre\n\n    if head is None:\n        print(\"삭제할 노드가 없습니다.(빈 리스트)\")\n        return\n\n    # 첫 번째 노드가 삭제 대상인 경우\n    if head.data == deleteData:\n        current = head\n        head = head.link\n        del(current)\n        return\n\n    # 그 외 노드 탐색\n    current = head\n    while current.link is not None:\n        pre = current\n        current = current.link\n        if current.data == deleteData:\n            pre.link = current.link\n            del(current)\n            return\n\n    print(f\"'{deleteData}' 데이터를 찾을 수 없습니다.\")\n\ndef clearList():\n    \"\"\"리스트 전체 초기화\"\"\"\n    global head\n    head = None\n    print(\"리스트가 초기화되었습니다.\")\n\ndef searchNode(target):\n    \"\"\"target을 검색해서 인덱스 리스트 반환\"\"\"\n    global head\n    indexes = []\n    current = head\n    idx = 0\n    while current is not None:\n        if current.data == target:\n            indexes.append(idx)\n        current = current.link\n        idx += 1\n    return indexes\n\ndef saveToFile(filename):\n    \"\"\"현재 리스트 데이터를 파일에 저장\"\"\"\n    data_list = get_list_data()\n    with open(filename, 'w', encoding='utf-8') as f:\n        for item in data_list:\n            f.write(str(item) + '\\n')\n    print(f\"리스트가 파일로 저장되었습니다. ({filename})\")\n\ndef loadFromFile(filename):\n    \"\"\"파일에서 데이터를 읽어 리스트 재구성\"\"\"\n    global head\n    try:\n        with open(filename, 'r', encoding='utf-8') as f:\n            lines = f.readlines()\n    except FileNotFoundError:\n        print(\"파일을 찾을 수 없습니다.\")\n        return\n\n    # 기존 리스트 초기화 후 다시 구성\n    head = None\n    for line in lines:\n        data = line.strip()\n        if data != '':\n            appendNode(data)\n    print(f\"파일에서 리스트를 불러왔습니다. ({filename})\")\n\n## 전역 변수 선언 부분 ##\nmemory = []\nhead, current, pre = None, None, None\n\n## 메인 코드 부분 ##\nif __name__ == \"__main__\":\n    # 초기 데이터 셋팅\n    dataArray = [\"서울대\", \"고대\", \"연대\", \"두원\", \"부산\"]\n    for data in dataArray:\n        appendNode(data)\n    \n    print(\"초기 연결 리스트:\")\n    printNodes(head)\n\n    # 사용자 입력 기반 메뉴\n    select = -1\n    while select != 9:\n        print(\"\\n--- 연결 리스트 메뉴 ---\")\n        print(\"1: 추가 (맨 뒤)\")\n        print(\"2: 삽입 (특정 데이터 앞에 삽입)\")\n        print(\"3: 삽입 (특정 위치에 삽입)\")\n        print(\"4: 삭제 (특정 데이터 삭제 / 삭제 전 확인)\")\n        print(\"5: 리스트 초기화\")\n        print(\"6: 검색 (데이터 -> 인덱스)\")\n        print(\"7: 파일 저장\")\n        print(\"8: 파일 불러오기\")\n        print(\"9: 종료\")\n\n        try:\n            select = int(input(\"메뉴 선택: \"))\n        except ValueError:\n            print(\"숫자를 입력하세요.\")\n            continue\n\n        if select == 1:\n            data = input(\"추가할 데이터 입력: \")\n            appendNode(data)\n            printNodes(head)\n        \n        elif select == 2:\n            findData = input(\"어느 데이터 앞에 삽입할까요? (찾을 데이터): \")\n            insertData = input(\"삽입할 데이터 입력: \")\n            insertNode(findData, insertData)\n            printNodes(head)\n        \n        elif select == 3:\n            try:\n                idx = int(input(\"삽입할 인덱스 번호 입력: \"))\n                data = input(\"삽입할 데이터 입력: \")\n                insertAt(idx, data)\n                printNodes(head)\n            except ValueError:\n                print(\"인덱스는 숫자로 입력해야 합니다.\")\n\n        elif select == 4:\n            delData = input(\"삭제할 데이터 입력: \")\n            confirm = input(f\"정말로 '{delData}'를 삭제할까요? (y/n): \")\n            if confirm.lower() == 'y':\n                deleteNode(delData)\n                printNodes(head)\n            else:\n                print(\"삭제를 취소했습니다.\")\n                printNodes(head)\n\n        elif select == 5:\n            clearList()\n            printNodes(head)\n\n        elif select == 6:\n            data = input(\"검색할 데이터 입력: \")\n            indexes = searchNode(data)\n            if indexes:\n                print(f\"'{data}' 데이터는 다음 인덱스에 있습니다: {indexes}\")\n            else:\n                print(f\"'{data}' 데이터는 리스트에 없습니다.\")\n\n        elif select == 7:\n            filename = input(\"저장할 파일 이름 입력 (예: data.txt): \")\n            saveToFile(filename)\n\n        elif select == 8:\n            filename = input(\"불러올 파일 이름 입력 (예: data.txt): \")\n            loadFromFile(filename)\n            printNodes(head)\n\n        elif select == 9:\n            print(\"프로그램을 종료합니다.\")\n        \n        else:\n            print(\"잘못된 선택입니다. 다시 입력하세요.\")",
  "answer_key": {
    "_type": "implementation_challenge",
    "_challenges": [
      {
        "signature": "class Node():",
        "body": "def __init__(self):\n        self.data = None\n        self.link = None",
        "line_num": 2,
        "type": "class"
      },
      {
        "signature": "def printNodes(start):",
        "body": "\"\"\"현재 연결 리스트 전체를 출력\"\"\"\n    current = start\n    if current is None:\n        print(\"(빈 리스트)\")\n        return\n    print(\"현재 리스트:\", end=' ')\n    print(current.data, end=' ')\n    while current.link is not None:\n        current = current.link\n        print(current.data, end=' ')\n    print()",
        "line_num": 7,
        "type": "function"
      },
      {
        "signature": "def get_list_data():",
        "body": "\"\"\"연결 리스트의 data들을 파이썬 리스트로 반환 (파일 저장용)\"\"\"\n    result = []\n    current = head\n    while current is not None:\n        result.append(current.data)\n        current = current.link\n    return result",
        "line_num": 20,
        "type": "function"
      },
      {
        "signature": "def appendNode(newData):",
        "body": "\"\"\"맨 뒤에 노드 추가\"\"\"\n    global head\n    node = Node()\n    node.data = newData\n    if head is None:\n        head = node\n        return\n    current = head\n    while current.link is not None:\n        current = current.link\n    current.link = node",
        "line_num": 29,
        "type": "function"
      },
      {
        "signature": "def insertNode(findData, insertData):",
        "body": "\"\"\"특정 데이터 앞에 삽입, 못 찾으면 맨 뒤에 추가\"\"\"\n    global head\n    \n    # 리스트가 비어 있을 경우\n    if head is None:\n        node = Node()\n        node.data = insertData\n        head = node\n        return\n\n    # 첫 번째 노드가 findData인 경우 (맨 앞 삽입)\n    if head.data == findData:\n        node = Node()\n        node.data = insertData\n        node.link = head\n        head = node\n        return\n\n    # 그 외 노드 탐색\n    current = head\n    while current.link is not None:\n        pre = current\n        current = current.link\n        if current.data == findData:\n            node = Node()\n            node.data = insertData\n            node.link = current\n            pre.link = node\n            return\n\n    # findData를 끝까지 못 찾으면 맨 뒤에 추가\n    node = Node()\n    node.data = insertData\n    current.link = node",
        "line_num": 42,
        "type": "function"
      },
      {
        "signature": "def insertAt(index, data):",
        "body": "\"\"\"특정 인덱스 위치에 노드 삽입\"\"\"\n    global head\n    \n    if index < 0:\n        print(\"인덱스는 0 이상이어야 합니다.\")\n        return\n\n    newNode = Node()\n    newNode.data = data\n\n    # 인덱스가 0 (맨 앞 삽입)\n    if index == 0:\n        newNode.link = head\n        head = newNode\n        return\n\n    # 중간 또는 끝 삽입을 위해 순회\n    current = head\n    currentIndex = 0\n    \n    # 삽입 위치 바로 직전(index-1)까지 이동\n    while current is not None and currentIndex < index - 1:\n        current = current.link\n        currentIndex += 1\n    \n    if current is None:\n        print(\"인덱스가 리스트의 길이를 초과했습니다.\")\n        return\n\n    # 삽입 실행\n    newNode.link = current.link\n    current.link = newNode",
        "line_num": 78,
        "type": "function"
      },
      {
        "signature": "def deleteNode(deleteData):",
        "body": "\"\"\"특정 데이터 삭제\"\"\"\n    global head, current, pre\n\n    if head is None:\n        print(\"삭제할 노드가 없습니다.(빈 리스트)\")\n        return\n\n    # 첫 번째 노드가 삭제 대상인 경우\n    if head.data == deleteData:\n        current = head\n        head = head.link\n        del(current)\n        return\n\n    # 그 외 노드 탐색\n    current = head\n    while current.link is not None:\n        pre = current\n        current = current.link\n        if current.data == deleteData:\n            pre.link = current.link\n            del(current)\n            return\n\n    print(f\"'{deleteData}' 데이터를 찾을 수 없습니다.\")",
        "line_num": 112,
        "type": "function"
      },
      {
        "signature": "def clearList():",
        "body": "\"\"\"리스트 전체 초기화\"\"\"\n    global head\n    head = None\n    print(\"리스트가 초기화되었습니다.\")",
        "line_num": 139,
        "type": "function"
      },
      {
        "signature": "def searchNode(target):",
        "body": "\"\"\"target을 검색해서 인덱스 리스트 반환\"\"\"\n    global head\n    indexes = []\n    current = head\n    idx = 0\n    while current is not None:\n        if current.data == target:\n            indexes.append(idx)\n        current = current.link\n        idx += 1\n    return indexes",
        "line_num": 145,
        "type": "function"
      },
      {
        "signature": "def saveToFile(filename):",
        "body": "\"\"\"현재 리스트 데이터를 파일에 저장\"\"\"\n    data_list = get_list_data()\n    with open(filename, 'w', encoding='utf-8') as f:\n        for item in data_list:\n            f.write(str(item) + '\\n')\n    print(f\"리스트가 파일로 저장되었습니다. ({filename})\")",
        "line_num": 158,
        "type": "function"
      },
      {
        "signature": "def loadFromFile(filename):",
        "body": "\"\"\"파일에서 데이터를 읽어 리스트 재구성\"\"\"\n    global head\n    try:\n        with open(filename, 'r', encoding='utf-8') as f:\n            lines = f.readlines()\n    except FileNotFoundError:\n        print(\"파일을 찾을 수 없습니다.\")\n        return\n\n    # 기존 리스트 초기화 후 다시 구성\n    head = None\n    for line in lines:\n        data = line.strip()\n        if data != '':\n            appendNode(data)\n    print(f\"파일에서 리스트를 불러왔습니다. ({filename})\")\n\n## 전역 변수 선언 부분 ##",
        "line_num": 166,
        "type": "function"
      },
      {
        "signature": "# 전역 변수 선언",
        "body": "memory = []\nhead, current, pre = None, None, None",
        "line_num": 185,
        "type": "code"
      },
      {
        "signature": "if __name__ == \"__main__\":",
        "body": "# 초기 데이터 셋팅\n    dataArray = [\"서울대\", \"고대\", \"연대\", \"두원\", \"부산\"]\n    for data in dataArray:\n        appendNode(data)\n    \n    print(\"초기 연결 리스트:\")\n    printNodes(head)\n\n    # 사용자 입력 기반 메뉴\n    select = -1\n    while select != 9:\n        print(\"\\n--- 연결 리스트 메뉴 ---\")\n        print(\"1: 추가 (맨 뒤)\")\n        print(\"2: 삽입 (특정 데이터 앞에 삽입)\")\n        print(\"3: 삽입 (특정 위치에 삽입)\")\n        print(\"4: 삭제 (특정 데이터 삭제 / 삭제 전 확인)\")\n        print(\"5: 리스트 초기화\")\n        print(\"6: 검색 (데이터 -> 인덱스)\")\n        print(\"7: 파일 저장\")\n        print(\"8: 파일 불러오기\")\n        print(\"9: 종료\")\n\n        try:\n            select = int(input(\"메뉴 선택: \"))\n        except ValueError:\n            print(\"숫자를 입력하세요.\")\n            continue\n\n        if select == 1:\n            data = input(\"추가할 데이터 입력: \")\n            appendNode(data)\n            printNodes(head)\n        \n        elif select == 2:\n            findData = input(\"어느 데이터 앞에 삽입할까요? (찾을 데이터): \")\n            insertData = input(\"삽입할 데이터 입력: \")\n            insertNode(findData, insertData)\n            printNodes(head)\n        \n        elif select == 3:\n            try:\n                idx = int(input(\"삽입할 인덱스 번호 입력: \"))\n                data = input(\"삽입할 데이터 입력: \")\n                insertAt(idx, data)\n                printNodes(head)\n            except ValueError:\n                print(\"인덱스는 숫자로 입력해야 합니다.\")\n\n        elif select == 4:\n            delData = input(\"삭제할 데이터 입력: \")\n            confirm = input(f\"정말로 '{delData}'를 삭제할까요? (y/n): \")\n            if confirm.lower() == 'y':\n                deleteNode(delData)\n                printNodes(head)\n            else:\n                print(\"삭제를 취소했습니다.\")\n                printNodes(head)\n\n        elif select == 5:\n            clearList()\n            printNodes(head)\n\n        elif select == 6:\n            data = input(\"검색할 데이터 입력: \")\n            indexes = searchNode(data)\n            if indexes:\n                print(f\"'{data}' 데이터는 다음 인덱스에 있습니다: {indexes}\")\n            else:\n                print(f\"'{data}' 데이터는 리스트에 없습니다.\")\n\n        elif select == 7:\n            filename = input(\"저장할 파일 이름 입력 (예: data.txt): \")\n            saveToFile(filename)\n\n        elif select == 8:\n            filename = input(\"불러올 파일 이름 입력 (예: data.txt): \")\n            loadFromFile(filename)\n            printNodes(head)\n\n        elif select == 9:\n            print(\"프로그램을 종료합니다.\")\n        \n        else:\n            print(\"잘못된 선택입니다. 다시 입력하세요.\")",
        "line_num": 189,
        "type": "main_block"
      }
    ],
    "_original_code": "## 클래스와 함수 선언 부분 ##\nclass Node():\n    def __init__(self):\n        self.data = None\n        self.link = None\n\ndef printNodes(start):\n    \"\"\"현재 연결 리스트 전체를 출력\"\"\"\n    current = start\n    if current is None:\n        print(\"(빈 리스트)\")\n        return\n    print(\"현재 리스트:\", end=' ')\n    print(current.data, end=' ')\n    while current.link is not None:\n        current = current.link\n        print(current.data, end=' ')\n    print()\n\ndef get_list_data():\n    \"\"\"연결 리스트의 data들을 파이썬 리스트로 반환 (파일 저장용)\"\"\"\n    result = []\n    current = head\n    while current is not None:\n        result.append(current.data)\n        current = current.link\n    return result\n\ndef appendNode(newData):\n    \"\"\"맨 뒤에 노드 추가\"\"\"\n    global head\n    node = Node()\n    node.data = newData\n    if head is None:\n        head = node\n        return\n    current = head\n    while current.link is not None:\n        current = current.link\n    current.link = node\n\ndef insertNode(findData, insertData):\n    \"\"\"특정 데이터 앞에 삽입, 못 찾으면 맨 뒤에 추가\"\"\"\n    global head\n    \n    # 리스트가 비어 있을 경우\n    if head is None:\n        node = Node()\n        node.data = insertData\n        head = node\n        return\n\n    # 첫 번째 노드가 findData인 경우 (맨 앞 삽입)\n    if head.data == findData:\n        node = Node()\n        node.data = insertData\n        node.link = head\n        head = node\n        return\n\n    # 그 외 노드 탐색\n    current = head\n    while current.link is not None:\n        pre = current\n        current = current.link\n        if current.data == findData:\n            node = Node()\n            node.data = insertData\n            node.link = current\n            pre.link = node\n            return\n\n    # findData를 끝까지 못 찾으면 맨 뒤에 추가\n    node = Node()\n    node.data = insertData\n    current.link = node\n\ndef insertAt(index, data):\n    \"\"\"특정 인덱스 위치에 노드 삽입\"\"\"\n    global head\n    \n    if index < 0:\n        print(\"인덱스는 0 이상이어야 합니다.\")\n        return\n\n    newNode = Node()\n    newNode.data = data\n\n    # 인덱스가 0 (맨 앞 삽입)\n    if index == 0:\n        newNode.link = head\n        head = newNode\n        return\n\n    # 중간 또는 끝 삽입을 위해 순회\n    current = head\n    currentIndex = 0\n    \n    # 삽입 위치 바로 직전(index-1)까지 이동\n    while current is not None and currentIndex < index - 1:\n        current = current.link\n        currentIndex += 1\n    \n    if current is None:\n        print(\"인덱스가 리스트의 길이를 초과했습니다.\")\n        return\n\n    # 삽입 실행\n    newNode.link = current.link\n    current.link = newNode\n\ndef deleteNode(deleteData):\n    \"\"\"특정 데이터 삭제\"\"\"\n    global head, current, pre\n\n    if head is None:\n        print(\"삭제할 노드가 없습니다.(빈 리스트)\")\n        return\n\n    # 첫 번째 노드가 삭제 대상인 경우\n    if head.data == deleteData:\n        current = head\n        head = head.link\n        del(current)\n        return\n\n    # 그 외 노드 탐색\n    current = head\n    while current.link is not None:\n        pre = current\n        current = current.link\n        if current.data == deleteData:\n            pre.link = current.link\n            del(current)\n            return\n\n    print(f\"'{deleteData}' 데이터를 찾을 수 없습니다.\")\n\ndef clearList():\n    \"\"\"리스트 전체 초기화\"\"\"\n    global head\n    head = None\n    print(\"리스트가 초기화되었습니다.\")\n\ndef searchNode(target):\n    \"\"\"target을 검색해서 인덱스 리스트 반환\"\"\"\n    global head\n    indexes = []\n    current = head\n    idx = 0\n    while current is not None:\n        if current.data == target:\n            indexes.append(idx)\n        current = current.link\n        idx += 1\n    return indexes\n\ndef saveToFile(filename):\n    \"\"\"현재 리스트 데이터를 파일에 저장\"\"\"\n    data_list = get_list_data()\n    with open(filename, 'w', encoding='utf-8') as f:\n        for item in data_list:\n            f.write(str(item) + '\\n')\n    print(f\"리스트가 파일로 저장되었습니다. ({filename})\")\n\ndef loadFromFile(filename):\n    \"\"\"파일에서 데이터를 읽어 리스트 재구성\"\"\"\n    global head\n    try:\n        with open(filename, 'r', encoding='utf-8') as f:\n            lines = f.readlines()\n    except FileNotFoundError:\n        print(\"파일을 찾을 수 없습니다.\")\n        return\n\n    # 기존 리스트 초기화 후 다시 구성\n    head = None\n    for line in lines:\n        data = line.strip()\n        if data != '':\n            appendNode(data)\n    print(f\"파일에서 리스트를 불러왔습니다. ({filename})\")\n\n## 전역 변수 선언 부분 ##\nmemory = []\nhead, current, pre = None, None, None\n\n## 메인 코드 부분 ##\nif __name__ == \"__main__\":\n    # 초기 데이터 셋팅\n    dataArray = [\"서울대\", \"고대\", \"연대\", \"두원\", \"부산\"]\n    for data in dataArray:\n        appendNode(data)\n    \n    print(\"초기 연결 리스트:\")\n    printNodes(head)\n\n    # 사용자 입력 기반 메뉴\n    select = -1\n    while select != 9:\n        print(\"\\n--- 연결 리스트 메뉴 ---\")\n        print(\"1: 추가 (맨 뒤)\")\n        print(\"2: 삽입 (특정 데이터 앞에 삽입)\")\n        print(\"3: 삽입 (특정 위치에 삽입)\")\n        print(\"4: 삭제 (특정 데이터 삭제 / 삭제 전 확인)\")\n        print(\"5: 리스트 초기화\")\n        print(\"6: 검색 (데이터 -> 인덱스)\")\n        print(\"7: 파일 저장\")\n        print(\"8: 파일 불러오기\")\n        print(\"9: 종료\")\n\n        try:\n            select = int(input(\"메뉴 선택: \"))\n        except ValueError:\n            print(\"숫자를 입력하세요.\")\n            continue\n\n        if select == 1:\n            data = input(\"추가할 데이터 입력: \")\n            appendNode(data)\n            printNodes(head)\n        \n        elif select == 2:\n            findData = input(\"어느 데이터 앞에 삽입할까요? (찾을 데이터): \")\n            insertData = input(\"삽입할 데이터 입력: \")\n            insertNode(findData, insertData)\n            printNodes(head)\n        \n        elif select == 3:\n            try:\n                idx = int(input(\"삽입할 인덱스 번호 입력: \"))\n                data = input(\"삽입할 데이터 입력: \")\n                insertAt(idx, data)\n                printNodes(head)\n            except ValueError:\n                print(\"인덱스는 숫자로 입력해야 합니다.\")\n\n        elif select == 4:\n            delData = input(\"삭제할 데이터 입력: \")\n            confirm = input(f\"정말로 '{delData}'를 삭제할까요? (y/n): \")\n            if confirm.lower() == 'y':\n                deleteNode(delData)\n                printNodes(head)\n            else:\n                print(\"삭제를 취소했습니다.\")\n                printNodes(head)\n\n        elif select == 5:\n            clearList()\n            printNodes(head)\n\n        elif select == 6:\n            data = input(\"검색할 데이터 입력: \")\n            indexes = searchNode(data)\n            if indexes:\n                print(f\"'{data}' 데이터는 다음 인덱스에 있습니다: {indexes}\")\n            else:\n                print(f\"'{data}' 데이터는 리스트에 없습니다.\")\n\n        elif select == 7:\n            filename = input(\"저장할 파일 이름 입력 (예: data.txt): \")\n            saveToFile(filename)\n\n        elif select == 8:\n            filename = input(\"불러올 파일 이름 입력 (예: data.txt): \")\n            loadFromFile(filename)\n            printNodes(head)\n\n        elif select == 9:\n            print(\"프로그램을 종료합니다.\")\n        \n        else:\n            print(\"잘못된 선택입니다. 다시 입력하세요.\")",
    "1": "def __init__(self):\n        self.data = None\n        self.link = None",
    "2": "\"\"\"현재 연결 리스트 전체를 출력\"\"\"\n    current = start\n    if current is None:\n        print(\"(빈 리스트)\")\n        return\n    print(\"현재 리스트:\", end=' ')\n    print(current.data, end=' ')\n    while current.link is not None:\n        current = current.link\n        print(current.data, end=' ')\n    print()",
    "3": "\"\"\"연결 리스트의 data들을 파이썬 리스트로 반환 (파일 저장용)\"\"\"\n    result = []\n    current = head\n    while current is not None:\n        result.append(current.data)\n        current = current.link\n    return result",
    "4": "\"\"\"맨 뒤에 노드 추가\"\"\"\n    global head\n    node = Node()\n    node.data = newData\n    if head is None:\n        head = node\n        return\n    current = head\n    while current.link is not None:\n        current = current.link\n    current.link = node",
    "5": "\"\"\"특정 데이터 앞에 삽입, 못 찾으면 맨 뒤에 추가\"\"\"\n    global head\n    \n    # 리스트가 비어 있을 경우\n    if head is None:\n        node = Node()\n        node.data = insertData\n        head = node\n        return\n\n    # 첫 번째 노드가 findData인 경우 (맨 앞 삽입)\n    if head.data == findData:\n        node = Node()\n        node.data = insertData\n        node.link = head\n        head = node\n        return\n\n    # 그 외 노드 탐색\n    current = head\n    while current.link is not None:\n        pre = current\n        current = current.link\n        if current.data == findData:\n            node = Node()\n            node.data = insertData\n            node.link = current\n            pre.link = node\n            return\n\n    # findData를 끝까지 못 찾으면 맨 뒤에 추가\n    node = Node()\n    node.data = insertData\n    current.link = node",
    "6": "\"\"\"특정 인덱스 위치에 노드 삽입\"\"\"\n    global head\n    \n    if index < 0:\n        print(\"인덱스는 0 이상이어야 합니다.\")\n        return\n\n    newNode = Node()\n    newNode.data = data\n\n    # 인덱스가 0 (맨 앞 삽입)\n    if index == 0:\n        newNode.link = head\n        head = newNode\n        return\n\n    # 중간 또는 끝 삽입을 위해 순회\n    current = head\n    currentIndex = 0\n    \n    # 삽입 위치 바로 직전(index-1)까지 이동\n    while current is not None and currentIndex < index - 1:\n        current = current.link\n        currentIndex += 1\n    \n    if current is None:\n        print(\"인덱스가 리스트의 길이를 초과했습니다.\")\n        return\n\n    # 삽입 실행\n    newNode.link = current.link\n    current.link = newNode",
    "7": "\"\"\"특정 데이터 삭제\"\"\"\n    global head, current, pre\n\n    if head is None:\n        print(\"삭제할 노드가 없습니다.(빈 리스트)\")\n        return\n\n    # 첫 번째 노드가 삭제 대상인 경우\n    if head.data == deleteData:\n        current = head\n        head = head.link\n        del(current)\n        return\n\n    # 그 외 노드 탐색\n    current = head\n    while current.link is not None:\n        pre = current\n        current = current.link\n        if current.data == deleteData:\n            pre.link = current.link\n            del(current)\n            return\n\n    print(f\"'{deleteData}' 데이터를 찾을 수 없습니다.\")",
    "8": "\"\"\"리스트 전체 초기화\"\"\"\n    global head\n    head = None\n    print(\"리스트가 초기화되었습니다.\")",
    "9": "\"\"\"target을 검색해서 인덱스 리스트 반환\"\"\"\n    global head\n    indexes = []\n    current = head\n    idx = 0\n    while current is not None:\n        if current.data == target:\n            indexes.append(idx)\n        current = current.link\n        idx += 1\n    return indexes",
    "10": "\"\"\"현재 리스트 데이터를 파일에 저장\"\"\"\n    data_list = get_list_data()\n    with open(filename, 'w', encoding='utf-8') as f:\n        for item in data_list:\n            f.write(str(item) + '\\n')\n    print(f\"리스트가 파일로 저장되었습니다. ({filename})\")",
    "11": "\"\"\"파일에서 데이터를 읽어 리스트 재구성\"\"\"\n    global head\n    try:\n        with open(filename, 'r', encoding='utf-8') as f:\n            lines = f.readlines()\n    except FileNotFoundError:\n        print(\"파일을 찾을 수 없습니다.\")\n        return\n\n    # 기존 리스트 초기화 후 다시 구성\n    head = None\n    for line in lines:\n        data = line.strip()\n        if data != '':\n            appendNode(data)\n    print(f\"파일에서 리스트를 불러왔습니다. ({filename})\")\n\n## 전역 변수 선언 부분 ##",
    "12": "memory = []\nhead, current, pre = None, None, None",
    "13": "# 초기 데이터 셋팅\n    dataArray = [\"서울대\", \"고대\", \"연대\", \"두원\", \"부산\"]\n    for data in dataArray:\n        appendNode(data)\n    \n    print(\"초기 연결 리스트:\")\n    printNodes(head)\n\n    # 사용자 입력 기반 메뉴\n    select = -1\n    while select != 9:\n        print(\"\\n--- 연결 리스트 메뉴 ---\")\n        print(\"1: 추가 (맨 뒤)\")\n        print(\"2: 삽입 (특정 데이터 앞에 삽입)\")\n        print(\"3: 삽입 (특정 위치에 삽입)\")\n        print(\"4: 삭제 (특정 데이터 삭제 / 삭제 전 확인)\")\n        print(\"5: 리스트 초기화\")\n        print(\"6: 검색 (데이터 -> 인덱스)\")\n        print(\"7: 파일 저장\")\n        print(\"8: 파일 불러오기\")\n        print(\"9: 종료\")\n\n        try:\n            select = int(input(\"메뉴 선택: \"))\n        except ValueError:\n            print(\"숫자를 입력하세요.\")\n            continue\n\n        if select == 1:\n            data = input(\"추가할 데이터 입력: \")\n            appendNode(data)\n            printNodes(head)\n        \n        elif select == 2:\n            findData = input(\"어느 데이터 앞에 삽입할까요? (찾을 데이터): \")\n            insertData = input(\"삽입할 데이터 입력: \")\n            insertNode(findData, insertData)\n            printNodes(head)\n        \n        elif select == 3:\n            try:\n                idx = int(input(\"삽입할 인덱스 번호 입력: \"))\n                data = input(\"삽입할 데이터 입력: \")\n                insertAt(idx, data)\n                printNodes(head)\n            except ValueError:\n                print(\"인덱스는 숫자로 입력해야 합니다.\")\n\n        elif select == 4:\n            delData = input(\"삭제할 데이터 입력: \")\n            confirm = input(f\"정말로 '{delData}'를 삭제할까요? (y/n): \")\n            if confirm.lower() == 'y':\n                deleteNode(delData)\n                printNodes(head)\n            else:\n                print(\"삭제를 취소했습니다.\")\n                printNodes(head)\n\n        elif select == 5:\n            clearList()\n            printNodes(head)\n\n        elif select == 6:\n            data = input(\"검색할 데이터 입력: \")\n            indexes = searchNode(data)\n            if indexes:\n                print(f\"'{data}' 데이터는 다음 인덱스에 있습니다: {indexes}\")\n            else:\n                print(f\"'{data}' 데이터는 리스트에 없습니다.\")\n\n        elif select == 7:\n            filename = input(\"저장할 파일 이름 입력 (예: data.txt): \")\n            saveToFile(filename)\n\n        elif select == 8:\n            filename = input(\"불러올 파일 이름 입력 (예: data.txt): \")\n            loadFromFile(filename)\n            printNodes(head)\n\n        elif select == 9:\n            print(\"프로그램을 종료합니다.\")\n        \n        else:\n            print(\"잘못된 선택입니다. 다시 입력하세요.\")"
  },
  "answer_count": 16,
  "created_at": "2025-12-06 06:38:15",
  "generation_method": "ai"
}